<!ELEMENT adresses (adresse)*>

<!ELEMENT adresse (titre?, nom, (boite_postale | numero_rue), codepostal_ville)>

<!ELEMENT titre (#PCDATA)>
<!ELEMENT nom (#PCDATA)>
<!ELEMENT boite_postale (#PCDATA)>
<!ELEMENT numero_rue (#PCDATA)>
<!ELEMENT codepostal_ville (#PCDATA)>


